date,hash,text,compound,sentiment
2009-04-06,129847555913823664,zurich does not have smelly bags anymore ,0.0,neutral
2009-04-06,-5925705471464158571,"in the university, in the classroom, on the computer... shit my day is boring ",-0.7096,negative
2009-04-06,9202940494723054620,I want to get back in bed ,0.0772,positive
2009-04-06,3031730268909971292,@fanofbsb4ever Sorry you missed it ,-0.3612,negative
2009-04-06,2949574237582986879,Worst burn of my life! so sick ,-0.8636,negative
2009-04-06,-6905600408137160951,"@PriscillaCruz So funny because I watched 'Only The Strong' today, what are the chances? I miss Capoeira   Zoom Zoom!",0.7897,positive
2009-04-06,3909628033049446772,It's official! I'm going to have an educational summer. Owh God. Bless me ,0.636,positive
2009-04-06,-2842097958381264921,@avisionofbeauty your phone doesn't like it  sorry,-0.2235,negative
2009-04-06,-7555811957728839338,too much to do  not enough motivation ,-0.2584,negative
2009-04-06,-6894158984952048640,@missoliviaa nooo brat. to the west coast hahaa quite making me sad ,-0.5209,negative
2009-04-06,-2833080195068439899,"oh everyone is going to sleep, how much i wish i could  its only 4.45pm, and im @ work!",0.4574,positive
2009-04-06,612066692605384343,"One thing I hate about dozing off in lects, I wake up to a sheaf of wet and badly smudged notes. ",-0.7783,negative
2009-04-06,-2395413157294259834,Sleepy head.. chances of actually sleeping? Slim to FUCKING NONE! ,0.2714,positive
2009-04-06,-8264543945387608550,Where has all my money gone?! ,0.0,neutral
2009-04-06,7979617553430045962,Now I'm down to 10% battery! ,0.0,neutral
2009-04-06,-3222251649183417283,@KristenjStewart just watched the trailer for adventureland on itunes looks so funny!! pity i don't think we get it in Australia ,0.4304,positive
2009-04-06,-6028704558097476489,"I'm so tired, have to get up and go in to school during holidays for the 3rd time  xxx",-0.1513,negative
2009-04-06,8962503644493877074,"OMG, more than 360 people is the death toll in Italy ",-0.5994,negative
2009-04-06,-8813394857201990862,@ThisismyiQ layin down...i dont feel well ,-0.2057,negative
2009-04-06,-8864697846213921780,@SCC_Skwerl Aww how depressing! ,-0.4389,negative
2009-04-06,1735506388573033960,@TheBlondeTheory  ditch in another parish. Some really sick people in this world. ,-0.5563,negative
2009-04-06,6948493948879639757,"Yo jimo i cant talk on aim anymore, its glitching  ill cya later and i hope u see this",0.0258,neutral
2009-04-06,-5417472625996131737,I just gave an msu fan a car rental discount.. He looked so sad I just couldn't turn him away.. ,-0.4002,negative
2009-04-06,-299762038644922199,"ordered a pita...it NEVR came! why they say the fax machine broke and the driver left, what about my empty BELLY ",-0.5983,negative
2009-04-06,-4445037020519483781,Britney was fucking amazing!! After we just went back to the hotel...I hate travelling with cheapos. ,0.2446,positive
2009-04-06,7460120355124114730,"@powerpoole some people try to be tricky, some stop using twitter at all  i guess it's as good as it gets! i had to try.",0.1007,positive
2009-04-06,8448938083066445351,@dra6on now I am sad cos u r sad ,-0.7351,negative
2009-04-06,6147111321605507933,@gotobekiddingme I tried.....and failed ,-0.5106,negative
2009-04-06,7589260076049297114,@ditty003 I'm looking at mine And I can't even get to it... School work sucks...atleast when u get home that's it  LOL,0.5473,positive
2009-04-06,-4154090966942859086,AC/DC rocked last night. Back to reality today.  70000 people without homes and &gt;150 dead in Italy ,-0.6486,negative
2009-04-06,-4392169366480321616,"@heatherlibby  Oh well, she seems like trouble. Christian Slater is trying to kill her at the moment.",-0.5859,negative
2009-04-06,-8111405422830175129,Hoping I can get some decent sleep tonight since I didn't get any worth shittt last night  Goodnight World! XOXO,0.7997,positive
2009-04-06,-4522929012334725365,i want diana F+. it looks great... ,0.6597,positive
2009-04-06,-2793349635942803175,i've got one of those spots that doesn't really show yet but hurts like hell and will no doubt be a beauty tomorrow ,-0.1116,negative
2009-04-06,2274017588447609972,@ekim1406 hehehe too bad they were separated ,-0.5423,negative
2009-04-06,7991710984575648709,Babe aint callin ,0.0,neutral
2009-04-06,-1152550731730002868,"@Hetty4Christ heh, yeah, I shakily conquered the ladder. Pointless job, tho. We're too far away to receive digital signal w/ antenna. ",-0.0258,neutral
2009-04-06,-3057312630042106638,"Good morning, hope everyone is feeling better than me.... this cold has really got hold now ",0.8481,positive
2009-04-06,-4836625682744569757,"Train rammed, fellow commuters vile . Special derision reserved for the man who appeared out of nowhere to claim 'his' seat. Luggage rack ",-0.5574,negative
2009-04-06,-6264400702057082870,@Kal_Penn I will miss you on the show... you were awesome!  What a shock!!  ,0.4168,positive
2009-04-06,787444210060206065,talking to a boy  hating work though ,-0.5106,negative
2009-04-06,-2366647868804860477,someone keep me up....im at work ,0.0,neutral
2009-04-06,-7604180358373019920,@LarrissaR please don't leave. stay for grant's bday ,0.3502,positive
2009-04-06,-1756482082390723419,@DanielCalderonL yeaah I hate that! ,-0.6114,negative
2009-04-06,-1940755371329600823,@pmelt the only bad thing about aids is you can only catch it once  Id want to inflict more pain on the deadshits of this world.,-0.7778,negative
2009-04-06,5346582747520903434,@childhoodflames whats wrong! ,-0.5255,negative
2009-04-06,-554293784798045695,"Off to bed now, sick n can't sleep but will try w/ help of meds :s ",-0.1027,negative
2009-04-06,5119147518352130255,Blip.fm is down...I'm going back to normal tweeting for a while. ,0.0,neutral
2009-04-06,9129208328823600955,@Lilylauren I get sad when ppl shave their moustaches  I don't know if I'd cry about it tho,-0.7351,negative
2009-04-06,-7224128235780926581,Oh my gosh... Oh my gosh...Susy is going to kill me with her remedy. ,-0.6908,negative
2009-04-06,-2694523963069432640,Finally going to sleep and waking up early to study ,0.0,neutral
2009-04-06,-5019170798663096203,I miss my friends from elementary and middle school ,0.3612,positive
2009-04-06,-6220774897860620953,"@cyantificNHS Balls  Although without the tunes, it's just a holiday then ;-)",0.5719,positive
2009-04-06,-5684761418389956694,chick corea was tonight...and I missed it  ...now she sobs,-0.6908,negative
2009-04-06,-7055292834294717628,I'm going to love this season of the hills... I can tell!  Spartans sucked.    Goodnight!!,0.4724,positive
2009-04-06,-2499132172117810463,needs to study for quant and do legal process assessment for 2moro ,0.128,positive
2009-04-06,-4256513564772803649,"@itsangie i canceled it, with plane tickets, hotel stay and tickets.. it was close to $400 if we eat cheaply.   man i soooo want to see O!",0.1511,positive
2009-04-06,8737623465536111373,"@polaroidskyline that sounds fair horrible.  i was going to repeat myself, but i guess the text I just sent you would do it better. whee.",0.5023,positive
2009-04-06,4677034569952113701,"@bivancamp aw, that suuuucks  Sorry dear!",0.3802,positive
2009-04-06,2375127314211509617,@NeYawn Yeah! Interview... Don't know even when it is... ,0.3595,positive
2009-04-06,3950521749378031432,"@LFTA So ur just gonna delete me like that...Y do I feel like &quot;Tom Cruise&quot; on Jerry Maguire when he got fired right now, yo.  LOL!",0.6399,positive
2009-04-06,-4045383607706130069,had the worst dream abt some turd face i used to date... ugh. it was awful. ,-0.836,negative
2009-04-06,3627587327667234373,@shresthayash  ouch I can just imagine a toothpic in the eye or something ,0.0,neutral
2009-04-06,-4946140420382688704,uh...I feel so lonely  I wish my BFFWIAMC (Best Friend Forever Who Is Also My Cousin) has a Twitter,0.7977,positive
2009-04-06,-6462430271888882394,Why do people keep following me and then randomly stop?  It makes me sad!,-0.68,negative
2009-04-06,-7493615366577365424,Still feeling bleh... Spew burps and all ,0.128,positive
2009-04-06,-8340659821945396506,hot deadline... ,0.0,neutral
2009-04-06,2479384951139926693,"has to return the shirt she bought from Topshop bc she has $50 in her bank account that has to last her the rest of the month, life sucks ",-0.3612,negative
2009-04-06,-6018534886550124360,woke up at 6am  far too early...more coffee then,0.0,neutral
2009-04-06,7240540458814899983,is tooooooooo cold. ,0.0,neutral
2009-04-06,602445808269017999,Why is it raining tomorrow night after it was sooo nice today?!  Guess I should be thankful that I was able to enjoy it at least.,0.8748,positive
2009-04-06,8422569186390683619,Michael Crichton ,0.0,neutral
2009-04-06,-7878181794353210910,CURSE MY SLOW INTERNET. I miss YouTube ,-0.7034,negative
2009-04-06,-3686712900156175470,feels a headache coming on! ,0.0,neutral
2009-04-06,-2336644505159951820,@gordonchiu You're one letter alway!    Koreans don't use &quot;X&quot; so there's no hope for me. ,-0.3986,negative
2009-04-06,4672178131846122739,Working on the Holy Week ,0.0,neutral
2009-04-06,264675646362727434,@marnieblaze haha nope. i guess nothing is original these days ,0.2589,positive
2009-04-06,831534873975087788,"Lots of revision to do tonight too for my final assessments. More assessments today as well, 90% pass mark is harsh ",-0.2023,negative
2009-04-06,-6897126883894323144,all thats stapling chipped my nails ,0.0,neutral
2009-04-06,-2999069708698428815, is cold,0.0,neutral
2009-04-06,-1243311060182855351,@PaulTeeter we passed by the border ,0.0,neutral
2009-04-06,-3684424118504275129,"Chewie update. OCD in left legs fixed, but possible OCD in Right leg as well, and worse still hip dysplasia in both hips  Not good...",-0.6817,negative
2009-04-06,7975446526719146273,Just got back from the hospital. BF's nephew might have meningitis ,0.0,neutral
2009-04-06,-7361728593411518434,Chi?u nay h?p chu?n b? t? ch?c m?y s? ki?n ? tr??ng ! Bao nhi�u vi?c ,0.0,neutral
2009-04-06,-1571655852063859074,is coldd ,0.0,neutral
2009-04-06,-4727578300007364217,Please watch this vid and tell me if you are not moved  http://www.youtube.com/watch?v=EUJSME0TORw,0.3182,positive
2009-04-06,-3137728663652353319,Boo another day at work  but only 3 to go then 3 days off ; ),0.0,neutral
2009-04-06,6106340376577278701,driving to schiphol. apperantly I am not the only one. Stuck around aalsmeer ,-0.25,negative
2009-04-06,6568316424980967091,Not anymore  how does Daisy manage to take up 75% of the bed?,0.0,neutral
2009-04-06,-8205299646920306977,@garretjiroux do u write back on twitter? i miss ya garee...  x,-0.1531,negative
2009-04-06,3035727122822826318,"Getting changed in the hopes that, that means we can go to the store now!  Poor cat is out of food...oops. ",-0.1511,negative
2009-04-06,177167614966368324,I'm in pain ,-0.5106,negative
2009-04-06,3486094284092217056,"@nicolerichie: Haha. Yeah, they were that band from MMC! I used to have a CD, but I lost it. ",-0.1635,negative
2009-04-06,1663023143733303515,i miss my bcd friends ,0.3612,positive
2009-04-06,1493212952153024896,@oliyoung But that requires assembly! Assembly is completely overrated tonight. This is harder than I thought ,0.0,neutral
2009-04-06,8136684825356133812,On a diet.... Woke up 2day Hungry ,0.0,neutral
2009-04-06,5693907937242060926,@JBeauty oooh *heads high killin 'em wit da no* lol didn't think so..  but u don't really know me yet I'm a good tucker inner haha,0.8674,positive
2009-04-06,-1363914385766569145,I hate cooking dinner ,-0.5719,negative
2009-04-06,2213771392286017196,@maikeru76 you aren't connected with me back...so I can't DM you...  ,0.0,neutral
2009-04-06,-1474081461067015835,My compassion to the people in italy! My mother is calling with our relatives in Italy right now  ,0.5093,positive
2009-04-06,-5810985333236520886,"@riskyrevenge Wait, what? Sick? ",-0.5661,negative
2009-04-06,-4271709046447377144,@oishiieats did they play polite dance song?? only my fav. please dont say they did. or course they did.   damn me!,0.686,positive
2009-04-06,-251466113788332850,I need to find a battery for an Elinchrom Ranger.  Nobody in Canada has any in stock ,0.0,neutral
2009-04-06,-603291778273446529,So now it's just a wait &amp; see game. I fall asleep &amp; it might or might not be there when I wake. ,0.0,neutral
2009-04-06,693648026415505087,Off to London today ,0.0,neutral
2009-04-06,-1773002965079576174,Smile like you mean it. Wow. This song brings back memories. Still can't sleep. ,0.8316,positive
2009-04-06,-4930707270021655259,@muzocan we should talk about this australia issue.. ,0.0,neutral
2009-04-06,47087273924183717,"I was woken up from a deep sleep just to be let go for Mad Max.  Not happy. And now, i can not sleep! ",-0.7572,negative
2009-04-06,-2351399167119837793,"Sorry, was getting ready.  Going to leave at 8am today.",0.25,positive
2009-04-06,8638077872625539754,Got a speeding ticket ,0.0,neutral
2009-04-06,-1361074878214684326,@kristensaywhaa he is an ass. .. .. .. hM ..  did you watch the first episodeee? i freakin missed it ,-0.6908,negative
2009-04-06,7537802319260287589,@scarletjac but not good for me close to my current challenge ,-0.3937,negative
2009-04-06,-8609546418808100047,"But the international font looks ugly. Going back to original font. After all, who'd tweet in malayalam ",-0.3612,negative
2009-04-06,8609959238910279797,doing some business studies revision ,0.0,neutral
2009-04-06,-808337442804956615,misses David actually ,-0.2263,negative
2009-04-06,959534724550020881,http://community.livejournal.com/ohnotheydidnt/33907252.html How freakin cool is that? Why doesnt shit like that happen to me? ,0.5383,positive
2009-04-06,8162742006866397631,I can't believe it. I got my answer and didn't have to ask the question.  This feels awful.,-0.4588,negative
2009-04-06,-2406941141979416564,Won't be tweeting much tonight   Maybe all tweets will come out in form of Tweet vomit later at about 1 in the morning.,0.0,neutral
2009-04-06,3573253405000242742,I think I need to get laid. Sad revolution I had earlier rofl  http://twurl.nl/ibz2wb,0.1531,positive
2009-04-06,-5117995081299917635,Txt-Chat with Jake. Lmfao. Its Frikkin Awesome! I Miss This Effin Boy So Much.  Awww. Hoping You Guys Would Come Back Here Na! ) xxxx,0.7765,positive
2009-04-06,-7433252134244201314,@ItsDawns Thank @rmilana don't like it  hehe but it's very easy and well I'm just a Danish Dude,0.8191,positive
2009-04-06,25327050018278318,"@Craftysince1990 Lol, that's sweet! I bought tickets last year &amp;&amp; my PartnerInCrime flaked so I didn't end up going  but this, FOR SURE!",0.8193,positive
2009-04-06,-860398426604536026,@razzberrie wha so now its 4GB! yay! haha no more laggy computers! but my mba cannot upgrade ,0.5386,positive
2009-04-06,2238653452488402823,@defsound aawwwww i know what u mean. iv never been that girl with a sense of humor ,0.2732,positive
2009-04-06,-3142138259260444515,@zaibatsu ME...I'm up.  ,0.0,neutral
2009-04-06,-4340450477249475756,was super lucky to get a seat on the train. We pay �40 for this 25 min journey. ,0.743,positive
2009-04-06,-979841587544119451,@Coyoteontherun Bet I-  Oh wait Mac?  No prolly not. ,-0.296,negative
2009-04-06,-6523076490520663616,"My navel piercing tore a bit when I was forcing my dog into the bed of my truck.  MY FAULT, I know.    It looks to be healing.  Yay!",-0.0836,negative
2009-04-06,-1402697985911491297,"wow! i got sick out of nowhere  and now i cant think straight....and mtv hasnt posted the hills online, wtf!",-0.5972,negative
2009-04-06,897299328523423679,Just woke up. Apples gig was ace last night. Seriously tired now. Work begins in one hour... ,-0.5574,negative
2009-04-06,-1844123599393826640,"Today's episode of &quot;House&quot; (Episode, Simple Explanation) was so heartbreaking. ",-0.5949,negative
2009-04-06,-7774150288695024307,I'm frankly disappointed and offended that there is a blogger writing AGAINST FU Penguin ,-0.8893,negative
2009-04-06,-297349875737993465,@tpaw wooo yeah! Sorry to hear you missed out on Origin tickets ,-0.1511,negative
2009-04-06,-2079206510854971810,Gooood mooorning world. I had a dream last night I fucked my knee again  Def need to kick start my strengthening ready for Bournemouth 7s!,0.3802,positive
2009-04-06,606908259836643903,I need some selsun blue...pretty sure i have a small spot of haole rot ,0.3182,positive
2009-04-06,-5191516080220170435,I think im coming down with something. ,0.0,neutral
2009-04-06,-3392308656665290568,re newing my twitter ,0.0,neutral
2009-04-06,-3710044154606933896,@lindseyviloria about that... I am gonna be in mexico ,0.0,neutral
2009-04-06,-2508155511726828092,@sweetlyaroundme ps I woke up this morning and I cant access any websites!  or I havent cleaned my computer completely,0.0,neutral
2009-04-06,-2542905610816978015,"Hates hearing his girl being ill, nothing I can do though ",-0.6908,negative
2009-04-06,1350288502087237776,"@SteveDiamond I know they have trouble, but I never heard a thing. I had MANY recommendations from MrTweet. ",-0.2144,negative
2009-04-06,5890066169417224041,@ScarlettDane no  mary &amp; i were going to go dress shopping tomorrow.,-0.296,negative
2009-04-06,-6707412881210249536,@NoelClarke Good morning you. Stop ignoring me just cos i said i like *cough* Take That  Am very sad now..boo hoo!,-0.4914,negative
2009-04-06,1597402797606514677,Feeling light headed and gross ,-0.3818,negative
2009-04-06,-3204097081342170476,thanks chaffie... thousand apologies. please fogive me 4 i have sinned. ,0.6369,positive
2009-04-06,-3907921246371392725,"@ItsChelseaStaub Goodnight, Chels. And sorry about the major layout-delay.  &lt;3",-0.0772,negative
2009-04-06,5706775251155416621,"@Coll_aka_Aubrey Oh, you were joking? Well now I'm crushed! I was totally gonna stand in the middle of a field and wave my arms! ",0.1984,positive
2009-04-06,3277023182634084134,Is waitin for th break down service as somethin fallen of my car. I've got my hot water bottle with me. Feel such a twat ,-0.7845,negative
2009-04-06,-8080429796903597094,@HolyJaw all in the middle if the night. I've committed myself to installing windows 7 with boot camp but I'm already having issues ,0.1406,positive
2009-04-06,-6132956962762838258,"@RedGray Ah man- so sad, his cousin committed suicide yest and she was 8 months pregnant  - can you imagine... we been crying non stop... ",-0.9134,negative
2009-04-06,-4874161802921264640,damn its down. ,-0.4019,negative
2009-04-06,7643262003932863303,Megan equals Murder. ,-0.6908,negative
2009-04-06,-6826547372354111918,poor Sandra Cantu. My heart goes out to her family and friends. Rest in Peace Little One! ,0.8398,positive
2009-04-06,-54178455705518541,morning all. v. groggy this morning.... ,0.0,neutral
2009-04-06,4691794604684527037,I feel soooo bad for my doglet!  She is not understanding why her mouth is so sore!  Poor little thing ,-0.8934,negative
2009-04-06,7771685115875264368,Why oh why do I watch videos of people dying RIGHT BEFORE I'm going to sleep? ,0.0,neutral
2009-04-06,7056400040983188746,why luke worral doesnt have twitter? ,0.0,neutral
2009-04-06,5652430545129054661,@Dynoisthename haha you better watch those two. They might actually kill each other. ,0.0516,positive
2009-04-06,4327938539851567817,twitter is a lot less interesting since cute people suddenly stopped flirting with me ,0.6179,positive
2009-04-06,5128357839413018255,My stomach is feeling satisfied now......been starving for 2 hours. ,0.128,positive
2009-04-06,-7253469647645799347,is very disappointed. ,-0.5256,negative
2009-04-06,-8033380834360516388,"I nearly spoiled myself for House, did just a teeny bit, saw a name, but then it went away via link.  I won't be terribly surprised now.  ",0.438,positive
2009-04-06,-3919032291500670699,@marlonjenglish ,0.0,neutral
2009-04-06,-3054275136114018878,@kittCAT8 ya i was basically screwed. just rewrote it  i will seriously go with you if you want! i dont know anyone else who wants to goo!,-0.6351,negative
2009-04-06,-2619904767400068730,@LRon_Jaii LMAOOO mornin baybeeee. Don't lie?! A peaceful journey?! My train is straight boring  not even a hooded teef in sight.,-0.6088,negative
2009-04-06,-4242139345669827305,I wish I had someone to talk to. I'm so upset.  no one likes me anyway,-0.668,negative
2009-04-06,99243144493500242,@Willie_Day26 hommmmeeworrkkk  boooo hope you fellas had a good night,0.7003,positive
2009-04-07,1989114659874119350,@Japh I wish I'd known that there were more tickets earlier. Rang this arvo - one left but Amy would end up sitting alone. Sigh  Too Hard.,-0.2732,negative
2009-04-07,-6888670658464423986,"woke up to find this cold/flu/illness-type thing isn't going without a fight and, apparently, beats you up in your sleep. Sorry, keynote ",0.2225,positive
2009-04-07,-2760708561527772938,"WHF?? T:SCC killed Derek Reese (Brian Austin Green), I actually liked that character! ",-0.5191,negative
2009-04-07,4451259801276334858,equinux.com just crashed safari tks you! ,0.0,neutral
2009-04-07,3803344465704991026,&quot;fire of anatolia&quot; is fired... costumes are destroyed... it's so poor situation ,-0.8805,negative
2009-04-07,4346668754383457323,"8:00am typical British morning. Cold, wet, road full of miserable angry drivers..... good times! I need a holiday ",-0.2942,negative
2009-04-07,-2074128327995361036,"really now, time for sleep.  dreaming of my city, more tattoos, and other great things.  waking up to early morning sociology ",0.6249,positive
2009-04-07,-716599621627660711,"Just bought Sour gummi worms, peach gummi O's, and cheeto puffs... AND a 44 ounce soda... I'm such a fat ass  Had a huge dinner too.",-0.296,negative
2009-04-07,-438789996124054783,"@Tubeyornot2B you and me both. I thought I found a tweetheart, but I guess not.  so the search continues.. :-\",-0.3291,negative
2009-04-07,6986975486877101011,"@Pixie_Anna scroll back a few hours, you missed a whole lotta Jon ",-0.296,negative
2009-04-07,6252066473080198732,@CyFyre no   finished two years then had twinzzzzzzzzzzz,-0.296,negative
2009-04-07,-1074769618198348885,Missed #24 and #the hills  now I have to catch up tomor.. But I have Real Housewives ugh I need to figure out my priorities,-0.6486,negative
2009-04-07,-3428568601978215157,"Oh, and it's officially my birthday. Happy 23rd birthday to me! *looks around* Yet no one is here to wish it to me  Erik's in bed.",0.6696,positive
2009-04-07,4716184526908798770,Needs the motivation to get dressed and go to work I hate training ,-0.3182,negative
2009-04-07,5256453326614511783,Didn't make it by here today.   They are saying we will have snow tomorrow. WTF?  It is Tennessee.  It doesn't even snow here in winter.,-0.6739,negative
2009-04-07,-3649099437101428383,I just had two people stop following me ,-0.296,negative
2009-04-07,8045494700273382306,Tried to fix hubby's computer. It didn't come with disks and now windows key won't work.  might have to buy it (like we can afford that),0.3612,positive
2009-04-07,6322374465571587721,@V3events  no way!?  Ur at a game right now!? ,-0.4843,negative
2009-04-07,13385240315108128,It seems that Twitter lost some updates yesterday - again!!  #twitter #fail,-0.7494,negative
2009-04-07,-6033555677241717284,my paronychia hurts ,-0.4767,negative
2009-04-07,-725387485295805213,http://twitpic.com/2y4vn - remember these days? neither do i. siiiiike. i miss my old body  someday soon u shall be miiiiine.,-0.1531,negative
2009-04-07,-2446985690137255760,back @ work. Had a bad start of day almost falling down the stairs  Not enjoying work yet...,-0.7638,negative
2009-04-07,-3555936392158345497,i &lt;3 CIGS..RIP ,0.0,neutral
2009-04-07,-2367934972256841011,"i'm up, so much paperwork to do today. `n i'm kinda getting sick  not fun",-0.6931,negative
2009-04-07,1662794101238947255,Just did 5km on the tready and want to die... I'm not built for running... ,-0.5574,negative
2009-04-07,7278121028324200168,@un1xnut if only I didn't work an evening/night job ,0.0,neutral
2009-04-07,-2985736971034508239,Need's help with this anxiety crap ,-0.1531,negative
2009-04-07,8835504181494273254,@CHASEBOOGIE lol dont ask i was being nice given a ride shit started bar b cueing on the freeway  lmao i been had mine ready,0.8225,positive
2009-04-07,1278002146779198484,"@azraeel Got home after 10 in the end, back in for a 9am start aswell ",0.0,neutral
2009-04-07,7518355616359856675,throat is so raw she cannot sleep....  ,0.0,neutral
2009-04-07,-1185220338506855680,// :T I just asked my friend what piglet was (winnie the pooh.) ....seriously guys what is it ,0.3612,positive
2009-04-07,3162117620780199596,i burnt my tongue on miso soup today ,0.0,neutral
2009-04-07,-8979428733116773964,had the worst dream abt some turd face ex.. ugh. it was awful. ,-0.836,negative
2009-04-07,2128645239533774051,Longing to own a sewing machine! My Birthday is too far away! ,-0.1739,negative
2009-04-07,-2590486540729326656,I havent slept a wink... Severe Insomnia... Arghhhh... Why!!! ,-0.5386,negative
2009-04-07,-7135864561300746180,@TerryFree Lol byeee time to go ,0.4215,positive
2009-04-07,587159492415324757,"@Skunkie Sorry, I guess sarcasm is hard to show in 130 characters.  ",-0.3818,negative
2009-04-07,2491002169009727855,"just microwaved a kashi chicken and spinach thing, and put in the Milk dvd. anyone seen it? i bet it's good. i still havent seen slumdog ",0.4404,positive
2009-04-07,-4982725218104678918,Just got up i have to watch my lil' bro's ... Mom is at work ,0.0,neutral
2009-04-07,4680269006404952396,oh god one of the teachers here gave me a rotten gogoma to eat.. and i'm so hungry i'm trying to eat around the bad parts  HAHAHAHA,-0.6908,negative
