date,hash,text,compound,sentiment
2009-04-06,-3226215024184122354,"@switchfoot http://twitpic.com/2y1zl - Awww, that's a bummer.  You shoulda got David Carr of Third Day to do it. ;D",-0.0173,neutral
2009-04-06,-8566799338810532356,is upset that he can't update his Facebook by texting it... and might cry as a result  School today also. Blah!,-0.75,negative
2009-04-06,-3994052962521124910,@Kenichan I dived many times for the ball. Managed to save 50%  The rest go out of bounds,0.4939,positive
2009-04-06,5913508604992698896,my whole body feels itchy and like its on fire ,-0.25,negative
2009-04-06,-2292813871534072460,"@nationwideclass no, it's not behaving at all. i'm mad. why am i here? because I can't see you all over there. ",-0.4939,negative
2009-04-06,-7406766267944406432,@Kwesidei not the whole crew ,0.0,neutral
2009-04-06,2292358609254127551,Need a hug ,0.4767,positive
2009-04-06,-6752845756081056180,"@LOLTrish hey  long time no see! Yes.. Rains a bit ,only a bit  LOL , I'm fine thanks , how's you ?",0.6208,positive
2009-04-06,-2323343448649231111,@Tatiana_K nope they didn't have it ,0.0,neutral
2009-04-06,2939096968243241452,@twittera que me muera ? ,0.0,neutral
2009-04-06,5923029712202514057,spring break in plain city... it's snowing ,0.0,neutral
2009-04-06,-7541026786358644087,I just re-pierced my ears ,0.0,neutral
2009-04-06,7837269442330336733,@caregiving I couldn't bear to watch it.  And I thought the UA loss was embarrassing . . . . .,-0.5994,negative
2009-04-06,-8305602002950358128,"@octolinz16 It it counts, idk why I did either. you never talk to me anymore ",-0.1027,negative
2009-04-06,1044330247920889076,"@smarrison i would've been the first, but i didn't have a gun.    not really though, zac snyder's just a doucheclown.",0.3724,positive
2009-04-06,5546335244273365481,@iamjazzyfizzle I wish I got to watch it with you!! I miss you and @iamlilnicki  how was the premiere?!,0.4545,positive
2009-04-06,7129782862007644066,Hollis' death scene will hurt me severely to watch on film  wry is directors cut not out now?,-0.9081,negative
2009-04-06,4195036046663976106,about to file taxes ,0.0,neutral
2009-04-06,-7135639409875432782,@LettyA ahh ive always wanted to see rent  love the soundtrack!!,0.6988,positive
2009-04-06,7884191777270566950,@FakerPattyPattz Oh dear. Were you drinking out of the forgotten table drinks? ,0.1779,positive
2009-04-06,7575320247633251883,@alydesigns i was out most of the day so didn't get much done ,0.0,neutral
2009-04-06,8840891724298255003,"one of my friend called me, and asked to meet with her at Mid Valley today...but i've no time *sigh* ",0.2325,positive
2009-04-06,-2956080034177965514,@angry_barista I baked you a cake but I ated it ,0.0,neutral
2009-04-06,7650122889298925509,this week is not going as i had hoped ,0.3818,positive
2009-04-06,8068936552686721728,blagh class at 8 tomorrow ,0.0,neutral
2009-04-06,-5155903248405692285,I hate when I have to call and wake people up ,-0.5719,negative
2009-04-06,397662852939821175,Just going to cry myself to sleep after watching Marley and Me.  ,-0.4767,negative
2009-04-06,8083280545897948183,im sad now  Miss.Lilly,-0.4767,negative
2009-04-06,-6341790940905720421,ooooh.... LOL  that leslie.... and ok I won't do it again so leslie won't  get mad again ,0.8106,positive
2009-04-06,-5107049848447154009,Meh... Almost Lover is the exception... this track gets me depressed every time. ,-0.024,neutral
2009-04-06,7386511295693925242,some1 hacked my account on aim  now i have to make a new one,-0.4019,negative
2009-04-06,-459382966570412545,@alielayus I want to go to promote GEAR AND GROOVE but unfornately no ride there  I may b going to the one in Anaheim in May though,-0.2144,negative
2009-04-06,-5456834652389942591,thought sleeping in was an option tomorrow but realizing that it now is not. evaluations in the morning and work in the afternoon! ,0.0,neutral
2009-04-06,-269341074388687178,@julieebaby awe i love you too!!!! 1 am here  i miss you,0.6973,positive
2009-04-06,-8920904827569079807,@HumpNinja I cry my asian eyes to sleep at night ,-0.4767,negative
2009-04-06,-6132670583639985102,ok I'm sick and spent an hour sitting in the shower cause I was too sick to stand and held back the puke like a champ. BED now ,-0.4939,negative
2009-04-06,-6894553933498741170,@cocomix04 ill tell ya the story later  not a good day and ill be workin for like three more hours...,-0.6711,negative
2009-04-06,-4812667781811190805,@MissXu sorry! bed time came here (GMT+1)   http://is.gd/fNge,-0.1511,negative
2009-04-06,-7336215879367171165,@fleurylis I don't either. Its depressing. I don't think I even want to know about the kids in suitcases. ,0.3578,positive
2009-04-06,-2965326770313189811,Bed. Class 8-12. Work 12-3. Gym 3-5 or 6. Then class 6-10. Another day that's gonna fly by. I miss my girlfriend ,-0.1531,negative
2009-04-06,-4415795604429647241,really don't feel like getting up today... but got to study to for tomorrows practical exam... ,-0.1746,negative
2009-04-06,8875482610750374882,He's the reason for the teardrops on my guitar the only one who has enough of me to break my heart ,0.6369,positive
2009-04-06,-2770846062019857421,"Sad, sad, sad. I don't know why but I hate this feeling  I wanna sleep and I still can't!",-0.8609,negative
2009-04-06,7786517985201723816,@JonathanRKnight Awww I soo wish I was there to see you finally comfortable! Im sad that I missed it ,0.2481,positive
2009-04-06,8966860420984206065,Falling asleep. Just heard about that Tracy girl's body being found. How sad  My heart breaks for that family.,0.128,positive
2009-04-06,534028497211703056,@Viennah Yay! I'm happy for you with your job! But that also means less time for me and you... ,0.629,positive
2009-04-06,-6306566078970736433,"Just checked my user timeline on my blackberry, it looks like the twanking is still happening  Are ppl still having probs w/ BGs and UIDs?",0.3612,positive
2009-04-06,8695754011092229646,Oh man...was ironing @jeancjumbe's fave top to wear to a meeting. Burnt it ,0.5719,positive
2009-04-06,4508998541942788024,is strangely sad about LiLo and SamRo breaking up. ,-0.6486,negative
2009-04-06,-9105073501422122693,@tea oh! i'm so sorry  i didn't think about that before retweeting.,-0.2578,negative
2009-04-06,4666526842362986258,Broadband plan 'a massive broken promise' http://tinyurl.com/dcuc33 via www.diigo.com/~tautao Still waiting for broadband we are ,-0.2023,negative
2009-04-06,-5598496814118025480,"@localtweeps Wow, tons of replies from you, may have to unfollow so I can see my friends' tweets, you're scrolling the feed a lot. ",0.7845,positive
2009-04-06,7611906711342312022,our duck and chicken are taking wayyy too long to hatch ,0.0,neutral
2009-04-06,5443344286562130352,"Put vacation photos online a few yrs ago. PC crashed, and now I forget the name of the site. ",-0.2263,negative
2009-04-06,-1246773591101106186,I need a hug ,0.4767,positive
2009-04-06,1065399854608472040,"@andywana Not sure what they are, only that they are PoS! As much as I want to, I dont think can trade away company assets sorry andy! ",-0.2134,negative
2009-04-06,-8233345561342061167,@oanhLove I hate when that happens... ,-0.5719,negative
2009-04-06,-5559736208384233407,"I have a sad feeling that Dallas is not going to show up  I gotta say though, you'd think more shows would use music from the game. mmm",-0.3818,negative
2009-04-06,-5683528688389138090,Ugh....92 degrees tomorrow ,0.0,neutral
2009-04-06,-8979398274070704345,Where did u move to?  I thought u were already in sd. ?? Hmmm. Random u found me. Glad to hear yer doing well.,0.6848,positive
2009-04-06,-5136221802888498042,"@BatManYNG I miss my ps3, it's out of commission  Wutcha playing? Have you copped 'Blood On The Sand'?",0.1431,positive
2009-04-06,-7865639148680624693,just leaving the parking lot of work! ,0.0,neutral
2009-04-06,29996060011454549,The Life is cool. But not for Me. ,0.1655,positive
2009-04-06,-6624204630066642271,"Sadly though, I've never gotten to experience the post coitus cigarette before, and now I never will. ",-0.4215,negative
2009-04-06,6577329106088484131,I had such a nice day. Too bad the rain comes in tomorrow at 5am ,-0.1779,negative
2009-04-06,1874561841374102242,@Starrbby too bad I won't be around I lost my job and can't even pay my phone bill lmao aw shucks ,-0.1541,negative
2009-04-06,-4052215877110947954,Damm back to school tomorrow ,0.0,neutral
2009-04-06,-7611281371657080515,"Mo jobs, no money.  how in the hell is min wage here 4 f'n clams an hour?",-0.7783,negative
2009-04-06,930059962042188364,@katortiz  Not forever... See you soon!,0.0,neutral
2009-04-06,2529665220420549997,"@Lt_Algonquin agreed, I saw the failwhale allllll day today. ",0.2732,positive
2009-04-06,5578922262911313892,@jdarter Oh! Haha... dude I dont really look at em unless someone says HEY I ADDED YOU. Sorry  I'm so terrible at that. I need a pop up!,-0.3131,negative
2009-04-06,4104025259827277195,@ninjen I'm sure you're right...    I need to start working out with you and the Nikster... Or Jared at least!,0.3802,positive
2009-04-06,-6128361594491658430,i really hate how people diss my bands!  Trace is clearly NOT ugly!,0.2484,positive
2009-04-06,8328797013562355203,"Gym attire today was: Puma singlet, Adidas shorts.......and black business socks and leather shoes  Lucky did not run into any cute girls.",0.7003,positive
2009-04-06,-7980708599161786584,Why won't you show my location?!   http://twitpic.com/2y2es,0.0,neutral
2009-04-06,5550424081211912378,No picnic  my phone smells like citrus.,0.0772,positive
2009-04-06,2348335817999060921,"@ashleyac My donkey is sensitive about such comments. Nevertheless, he'd (and me'd) be glad to see your mug asap. Charger is still awol. ",0.1779,positive
2009-04-06,6452561253082251439,No new csi tonight.  FML,-0.296,negative
2009-04-06,4734436828700925041,i think my arms are sore from tennis ,-0.3612,negative
2009-04-06,-7762462973612280669,wonders why someone that u like so much can make you so unhappy in a split seccond . depressed . ,-0.6615,negative
2009-04-06,2026025556804719014,sleep soon... i just hate saying bye and see you tomorrow for the night. ,-0.5719,negative
2009-04-06,-4419592165636975758,"@statravelAU just got ur newsletter, those fares really are unbelievable, shame I already booked and paid for mine ",-0.315,negative
2009-04-06,9195675807220953704,missin' the boo ,0.0,neutral
2009-04-06,1899418140097137685,@markhardy1974 Me too  #itm,0.0,neutral
2009-04-06,913079244499894700,Damn... I don't have any chalk! MY CHALKBOARD IS USELESS ,-0.7597,negative
2009-04-06,-4975619523055565346,"had a blast at the Getty Villa, but hates that she's had a sore throat all day. It's just getting worse too ",-0.9052,negative
2009-04-06,-4004639195785524927,@msdrama hey missed ya at the meeting  sup mama,-0.296,negative
2009-04-06,-6681578634992204775,"My tummy hurts.  I wonder if the hypnosis has anything to do with it? If so, it's working, I get it, STOP SMOKING!!!",-0.7851,negative
2009-04-06,6763526209383012551,why is it always the fat ones?! ,0.0,neutral
2009-04-06,6693960154115474404,"@januarycrimson Sorry, babe!!  My fam annoys me too. Thankfully, they're asleep right now. Muahaha. *evil laugh*",-0.3987,negative
2009-04-06,7814529561876368656,@Hollywoodheat I should have paid more attention when we covered photoshop in my webpage design class in undergrad ,0.0,neutral
2009-04-06,3452288242575443819,wednesday my b-day! don't know what 2 do!! ,0.0,neutral
2009-04-06,6467758120119578072,Poor cameron (the hills) ,-0.4767,negative
2009-04-06,6112237560865491279,"pray for me please, the ex is threatening to start sh** at my/our babies 1st Birthday party. what a jerk. and I still have a headache ",0.128,positive
2009-04-06,-3660048601661339314,"@makeherfamous hmm  , do u really enjoy being with him ? if the problems are too constants u should think things more , find someone ulike",0.2006,positive
2009-04-06,3111905589290789754,Strider is a sick little puppy  http://apps.facebook.com/dogbook/profile/view/5248435,-0.5106,negative
2009-04-06,-5502462292631946418,"so rylee,grace...wana go steve's party or not?? SADLY SINCE ITS EASTER I WNT B ABLE 2 DO MUCH  BUT OHH WELL.....",0.7843,positive
2009-04-06,-2167331228455067305,"hey, I actually won one of my bracket pools! Too bad it wasn't the one for money ",0.126,positive
2009-04-06,78503274749591768,"@stark YOU don't follow me, either  and i work for you!",0.0,neutral
2009-04-06,-8101336101009683317,A bad nite for the favorite teams: Astros and Spartans lose.  The nite out with T.W. was good.,-0.0772,negative
2009-04-06,-2931551005152488493, Body Of Missing Northern Calif. Girl Found: Police have found the remains of a missing Northern California girl .. http://tr.im/imji,-0.5267,negative
2009-04-06,792284796276568121,"@mangaaa I hope they will increase the capacity fast, yesterday was such a pain. Got the fail whale +15 times in 2 hours.... ",-0.3818,negative
2009-04-06,2664821123436945802,Behind on my classes for work ,0.0,neutral
2009-04-06,3280910552752330030,watching &quot;House&quot; ,0.0,neutral
2009-04-06,7609844391630123531,@kpreyes Remember my bum leg? Strikes back this time its serious ,-0.4215,negative
2009-04-06,-2695529861629752933,"@paradisej cool, i will. their are all kinds of complaints about this laptop online about overheating, but no recalls ",-0.4588,negative
2009-04-06,-7882407428061302123,Emily will be glad when Mommy is done training at her new job. She misses her.  http://apps.facebook.com/dogbook/profile/view/6176014,0.2732,positive
2009-04-06,4850605120069212846,would rather the first party send bad messages than the 3rd party send mixed ones  Sophmore year all over again?,0.2263,positive
2009-04-06,-3400185185219281293,@Henkuyinepu it's overrated ,0.0,neutral
2009-04-06,-6275011960139406727,@marykatherine_q i know! I heard it this afternoon and wondered the same thing. Moscow is so behind the times ,0.0,neutral
2009-04-06,8923660998877574799,laying in bed with no voice.. ,-0.296,negative
2009-04-06,3892125249450481588,I'm sooo sad!!! they killed off Kutner on House  whyyyyyyyy,-0.8582,negative
2009-04-06,7958772021916129981,@jacobsummers Sorry  tell them mea culpa from me and that I really am sorry.,-0.2212,negative
2009-04-06,3249226499578323170,"@Alliana07 it didn't make any sense to me, the suicide thing. I refuse to believe that that is actually what happened. ",-0.7717,negative
2009-04-06,2096818905006867952,@salancaster  hope your ok.,0.4404,positive
2009-04-06,-8538713609658087472,@mercedesashley Damn! The grind is inspirational and saddening at the same time.  Don't want you to stop cuz I like what u do! Much love,0.5043,positive
2009-04-06,-8048434469618779259,@HibaNick yeah aw but i know i wudnt stand a chance ,0.4767,positive
2009-04-06,8320430106606970905,ugh. cant sleep. its 1:30am. ,-0.4215,negative
2009-04-06,-7735151946699123679,Hanging in Crooners. Wanna sing. Can't. Sucks. ,0.2755,positive
2009-04-06,-7858868035677020603,@eRRe_sC aaw i miss ya all too.. im leaving to BH tomorrow &quot;morning&quot; i think.. aww i wanna go to the beach w u girls!! ,-0.2924,negative
2009-04-06,-7249131492508953939,Is pissed off that there's no ASBA's for a radio station. ,-0.7506,negative
2009-04-06,-1360084390872965580,wednesday my b-day n don't know what 2 do!  ,0.0,neutral
2009-04-06,-2656973922445550510,I know my life has been flipped upside down when I just thought in my head that some Ramen sounds good. ,0.4404,positive
2009-04-06,-8319984789056668769,I am in pain. My back and sides hurt. Not to mention crying is made of fail. ,-0.8246,negative
2009-04-06,2655086391946747782,"Late night snack, glass of OJ b/c I'm &quot;down with the sickness&quot;, then back to sleep...ugh I hate getting sick... ",-0.7906,negative
2009-04-06,-8668012516194160743,@allyheman but.. but.. but.. I'm not a big fan on camilla belle ,-0.3491,negative
2009-04-06,-2660557000972604786,"@grum WAH I can't see clip, must be el-stupido work filters. Can't wait 'till I get a 'puter. Something else 2 blame ex 4. He broke mine ",-0.6369,negative
2009-04-06,-1405020218902751824,This week just seems to get longer and longer in terms of how much I need to do.. and how much I'm actually going to get done ,0.0,neutral
2009-04-06,3062084454786230768,I'm so cold ,0.0,neutral
2009-04-06,2659478581599933652,@thecoolestout Ehhh don't. Weather's gonna take a turn for the ugly tomorrow ,-0.5106,negative
2009-04-06,-3050445701585126900,@chelserlynn haha its so cooooold in the d! and no  but you should still go to the show. they do some incredible stuff,0.1759,positive
2009-04-06,-288379687169942025,Hoping the tummy rumbles go away soon ,0.4215,positive
2009-04-06,-2002997489357577171,"@Knights_ No, no notice. They told me I'd be working tomorrow, and then I called the agency to follow up and they said it was over. ",-0.296,negative
2009-04-06,1134643886972030446,almost bedtime ,0.0,neutral
2009-04-06,-4041002966537726548,I'm missing you babe..  but as long as your alive I'm happy.. Yawwwnn.. I'm tired my love imma try to sleep hopefully you had a headstart,0.9366,positive
2009-04-06,-7186617680106990231,Agh...snow!!! ,0.0,neutral
2009-04-06,-66602579505781254,i miss kenny powers ,-0.1531,negative
2009-04-06,-2770625427951155440,"@BridgetsBeaches Thank you for letting people know, but now I'm sad that the direct message I got wasn't actually from Bridget ",-0.5267,negative
2009-04-06,5404191044019858760,"...and, India missed out its 100th Test victory n 10th consecutive win without a loss. ",0.5517,positive
2009-04-06,-5850407469789134801,@JonathanRKnight I guess that's a no then. ,-0.296,negative
2009-04-06,1328592784441621845,sadly is going to bed. ,-0.4215,negative
2009-04-06,9016838027729401819,@ozesteph1992 Shame to hear this Stephan ,-0.4767,negative
2009-04-06,-7928883027413205830,@mrsaintnick hey! i'm leavin in the morning... ,0.0,neutral
2009-04-06,8025165052967594057,"Was intending to finish editing my 536-page novel manuscript tonight, but that will probably not happen. And only 12 pages are left ",0.1655,positive
2009-04-06,-7216640122569716728,laid around too much today... now my head hurts ,-0.4767,negative
2009-04-06,259968493482333286,@twista202 I still haven't read the 9th&amp;10th Princess diaries  Saving Francesca made me cry at the end. Hmm those are easy books.,-0.0516,negative
2009-04-06,-1325506262658198514,my nokia 1110 died..  ,-0.5574,negative
2009-04-06,-3401809343234457044,My mom might have breast cancer won't find out anything for. Like a week I'm so worried! ,-0.7234,negative
2009-04-06,-4533512026606857500,Going to sleep. Hoping tomorrow is a better day. ,0.6908,positive
2009-04-06,-8322550199520030669,@rumblepurr lol.. wish they understood daylight savings has ended though and breakfast is an hour later  They keep waking the kids up too,0.6705,positive
2009-04-06,5553420743663842456,@onemoreproject that is lame ,-0.4215,negative
2009-04-06,3295360997956794270,I don't understand... I really don't ,0.0,neutral
2009-04-06,8068706392310355463,HEROES just isn't doing it for me this season... ,0.6166,positive
2009-04-06,-8441440549222478816,Living not downtown sure isn't much fun.  ,-0.5667,negative
2009-04-06,-5968642167272394620,@jonathanchard Not calorie wise   I wish junk food was calorie free! I ate a thing of sour skittles and a big ass cherry coke!,-0.1625,negative
2009-04-06,-5238186352585448210,Man Work is Hard ,-0.1027,negative
2009-04-06,8267283001000434947,"getting sick  time for some hot tea, studying, and then sleeeep",-0.5106,negative
2009-04-06,-8884864086614745132,Getting eyebrows waxed. More pain ,-0.5563,negative
2009-04-06,-6368994300923093621,No phantasy star yesterday  going to work...,-0.296,negative
2009-04-06,2342687334867740362,Oh - Just got all my MacHeist 3.0 apps - sweet. Didn't get the Espresso serial no though although they said they sent it - oh well ,0.4404,positive
2009-04-06,-1710637351159750173,Picked Mich St to win it all from the get go.  Was feeling pretty good about that pick all the way up until......tonight.  A's lost too ,0.8442,positive
2009-04-06,437785779239280529,is alone downstairs...working ,-0.25,negative
2009-04-06,3679827914947727993,I feel bad for doing it ,-0.5423,negative
2009-04-06,-5225484802692394705,"@RyanSeacrest is it just me, or she hates anoop. i mean seriously, she's kinda mean to him. ",-0.5574,negative
2009-04-06,1637053037209937692,@pinkserendipity yes sprint has 4g only in baltimore and chicago so far ,0.4019,positive
2009-04-06,-4929656751402050067,I'm stuck awake in the middle of the night for the second day in a row. And I felt terrible yesterday. ,-0.6249,negative
2009-04-06,-1937770631414538053,Thanks for bursting my bubble ,0.4404,positive
2009-04-06,-8685893885641944722,Going to school soon... can't find anything to wear!! gosh it's so hard ,-0.3507,negative
2009-04-06,2422025115307758650,@marieclr I was serious  LOL,0.4995,positive
2009-04-06,9200861210073603966,@naughtyhaughty I had on my page for sooooo long!!! Until it got deleted  Sad day in history,-0.6093,negative
2009-04-06,-3169435286107480686,Crazy wind today = no birding  http://ff.im/1XTTi,-0.5574,negative
2009-04-06,1036409185638284816,currently at work.. ,0.0,neutral
2009-04-06,3057537764553303163,Grrr.. my ipods acting weird too! Jai ho and thinking of you aren't playing the full songs.. ughh. ,-0.4559,negative
2009-04-06,6539620936860255886,@penndbad send me the DVD cos I have missed out on heaps  NOT happy about that!,-0.6694,negative
2009-04-06,-5384691629366486828,i don't see the big deal with this website ,0.0,neutral
2009-04-06,1536392678710271483,@machineplay I'm so sorry you're having to go through this. Again.  #therapyfail,-0.188,negative
2009-04-06,-1421467449982860492,@ColinDeMar Far too out of the way for rail.  any other tips?,0.0,neutral
2009-04-06,7942148620139963845,I'm not still up I swear. Why do I keep losing. gaining. losing. gaining. tweeps?  So heart wrenching.,0.6901,positive
2009-04-06,7916769156553244322,"Today I realized I am too good at hiding things, even I can't find it ",0.1779,positive
2009-04-06,4764655648082653064,"Staying at a friends house...house sitting, neighbors are SO loud-having a party ",0.7733,positive
2009-04-06,7965754276969720049,@dannyvegasbaby danny im upset that i wasnt here to watch the live chat  i was in a car. for 3 hours on a trip im soooo upset!!,-0.6988,negative
2009-04-06,-8244073824306576960,Check out my mug  http://www.erika-obscura.blogspot.com,0.0,neutral
2009-04-06,-642353452946828053,Borders closed at 10 ,0.0,neutral
2009-04-06,-4559756459747407275,Downloading NIN's new album &quot;the slip&quot; - when the hell did this come out? I'm so behind the times these days ,-0.6808,negative
2009-04-06,2982785416957883129,Just woke up an already have written some e-mail... I've to go early at University today as I have to teach at 8:30 AM! ,0.0,neutral
2009-04-06,-6344391512054613640,is watching the hill . . .and its making me sad ,-0.4767,negative
2009-04-06,2785586075023591600,So many channels.... yet so so boring... lazy day again  may have to find a hobby,-0.7492,negative
2009-04-06,-8274407020895302739,@supersport I miss my buddy  ill be in NY on the 25th,-0.5267,negative
2009-04-06,-3828357811600845093,@robluketic  love the french. I tell people here in the south i'm qtr. french and they snarl at me.  french are beautiful people,0.8442,positive
2009-04-06,-8132689530292492968,Opps.. As I said.. I still got one day remain and now problem come ,-0.4019,negative
2009-04-06,5552069899970136769,"I activated my Selfcontrol block early, meaning I can't check out the new QC.  Regularizing my internal clock is might be difficult. #fb",-0.6597,negative
2009-04-06,5893687313602882954,@HillyDoP  oH NO,-0.4466,negative
2009-04-06,-455083443544689553,spencer is not a good guy. ,-0.3412,negative
2009-04-06,-8451776002049419844,"@goodlaura What about Reese dying on #TTSC? And season finale next week.  #24 boring, Madame President is a crazy woman.",-0.5719,negative
2009-04-06,-3246704145267585652,"@JonathanRKnight I hate the limited letters,too.Hope you and the guys are fine?I pray for my dog,she�s not well ",-0.6266,negative
2009-04-06,5704352246986683259,didn't get shit done today ~ i'm so screwed ,-0.2942,negative
2009-04-06,-1269652804953348707,wanttss to go out ,0.0,neutral
2009-04-06,2521663172799482486,Is not going to sleep tonite. ,0.0,neutral
2009-04-06,-5580920157504795227,too worried and tired to post tonight ,-0.6249,negative
2009-04-06,-775131193914609737,couldn't get shit done today ~ i'm so screwed ,-0.2942,negative
2009-04-06,5230623044816981496,"Job Interview in Cardiff today, wish me luck! Got about 3 hours sleep ",0.7177,positive
2009-04-06,-7022920845682114861,"@stustone Your show is whack. Way worse than whack, it's wiggety-whack.    :*(:*(:*(",-0.4767,negative
2009-04-06,-6246201817669331150,@DjAlizay I really don't think people choose to be that way. But I think he chose not to accept my family's help   He might be dead by now,-0.7332,negative
2009-04-06,-5837340497267597058,"@eloquentembrace You're going to kill me, but I've not seen DS9. I've been waiting till I can do it in one solid week sitting. ",-0.2382,negative
2009-04-06,-3965478482356698198,@cheechbud i think ur right!! hahaha!! 4.5 hrs now!! ,0.6973,positive
2009-04-06,-6094548527450507391,i hate to see the spartans so sad ,-0.8267,negative
2009-04-06,-7969855242954685373,My mind and body are severely protesting this &quot;getting up&quot;  thing. Had nightmares to boot ,-0.7003,negative
2009-04-06,8080710438428609859,"@MySteezRadio I'm goin' to follow u, since u didn't  LOL  GO ANGELS!",-0.4882,negative
