date,hash,text,compound,sentiment
2009-04-07,-5819201565153520241,@George_Mackie i dont sell very often on ebay. ,0.0,neutral
2009-04-07,3249220840908359200,@tommcfly did you know that johnsons baby use animals like cute bunnies to test their products? ,0.6705,positive
2009-04-07,6536830390523793340,can't sleep bc I drank a diet coke @ 9pm....sucks bc I have to wake up at 5:30am  ,0.0,neutral
2009-04-07,-709962821491599994,one triop down... one to go ,0.0,neutral
2009-04-07,-6724096173019775336,Damn... I need to learn ,-0.4019,negative
2009-04-07,-8499100441365427765,darn it !!!  I woke up with a great idea for a LIME article and I forgot what it was ,0.7163,positive
2009-04-07,-1310784353681518223,thinking the shorts and flip flops may have been a bad idea ,-0.7096,negative
2009-04-07,-1558104696951818195,@mikebreed Its all up to us Mike.  I understand what you say but I think its us that need to change  my opinion but yours is good too! lol,0.8335,positive
2009-04-07,-5455299194377425040,I'm waiting for a parcel and it's just not arriving  *argh* *hurry up* *hurry up*,0.0,neutral
2009-04-07,-5076943518034349419,"@Knot2serious oh! Btw,@djrocko951 &amp; I tried to go to that Cuban buffet I told u about,so excited..it's closed on Mondays  SAD story!",-0.6616,negative
2009-04-07,5971310194809148649,@gingha It is!  I have the docs so morning off and then into work   Freecycling?  What you getting?,0.0,neutral
2009-04-07,6475833539490572584,should have stayed at home ,0.0,neutral
2009-04-07,-8049558112818735304,Bit lonely on here - don't seem to have many friends who actually use Twitter!    Oh well...,0.4574,positive
2009-04-07,-6012958036002631718,@ArtemisIII Oh no  is it the laundry powder maybe? I'm allergic to some and since jeans are usually so fitted it makes it worse,-0.7579,negative
2009-04-07,1047752010698605222,I need some inspiration before i hit the kitchen tonight ,0.5267,positive
2009-04-07,7885626870311910137,accidentally listened to the new sugababes album   playing four girls aloud hits sequentially to purge the memory,-0.1531,negative
2009-04-07,-6582555207267072284,going to walk my dogs and shower before bed.   sad the yankees lost the first game monday too!  boooo ,-0.69,negative
2009-04-07,8190244177874227208,"@ExMi Hey doll, sorry to hear bout ur doggie  Hope he comes home soon!  Would help u look if i weren't so far away!!",0.7332,positive
2009-04-07,-7981640618957290947,Is upset that she couldn't find &quot;Church of the Flying Spaghetti Monster&quot; on Twitter to follow ,-0.3818,negative
2009-04-07,4879007022384894059,why won't anyone enjoy pretty films with me ,-0.6435,negative
2009-04-07,-7241301202812925459,feels like I am comming down with something....let's hope it's just a cold ,0.6597,positive
2009-04-07,7745514476264835883,is NOT sleeping ....damnit. T-minus 4 hours and counting until i have to get the kids up for school ,0.4168,positive
2009-04-07,-5790116100727471443,@rochellesheree I missed you...  is wednesday your day off? or is that thursday?,-0.3736,negative
2009-04-07,-8428264336060441492,"Missed the train to York, no Wifi and blackberry battery is going to die soon - not a good start to the day ",-0.866,negative
2009-04-07,21587286136006298,@TheoryOfMind @woppygook OMNIAAAA!!! I said no to the crackberrryyy. Time to depart with my flip phone ,-0.4724,negative
2009-04-07,-9055592398635115887,hermes packetdienst sucks ,-0.3612,negative
2009-04-07,5324836755074286854,Had too much fun last night- paying for it now... going to go and fry an egg ,0.5106,positive
2009-04-07,8617114239227746166,No squirrels today  They must be hiding.,-0.5267,negative
2009-04-07,5063384541535222980,@nmcgivney yeah ploughed around there last night.. .but nothing happening ,0.1531,positive
2009-04-07,-6198477639333490170,@Ali1702 OMG- did daughter not come home last night?? What a huge worry. I would have been out of my mind. Poor you! ,-0.6544,negative
2009-04-07,-1267528152667657752,Just bought a car and my impending fatherhood is affecting my judgement.  Out with plans of a 330CI and in with a Rav-4 ,0.0,neutral
2009-04-07,4303364157451679034,"Even after the Aust. gov. rolls out its $43 Bln 100Mb b'band, we'll still be way behind most of the rest of the worlds b'band speeds ",0.0,neutral
2009-04-07,-1802239624841277138,@bnish dan and i grabbed yardhouse earlier. why didn't you pirate it?! i was so disappointed ,-0.6466,negative
2009-04-07,845814395995452289,in work early for team meeting but forgot my lunch ,0.0,neutral
2009-04-07,-8348041157603646380,I'm not worried about them cutting my hours down so i start at 10.00am every day...... Except i may have to give up my morning Starbucks ,0.0997,positive
2009-04-07,7181144126672356386,@mrjoe sorry to hear about the bike ,-0.0772,negative
2009-04-07,-7698117034579937370,@aliceverheij on MS XP im afriad  laptop is about 3yrs old and think its just a bit messed up ,0.2342,positive
2009-04-07,-7625155321302475494,"...well I was going to RPM. Vespa needs oil, I ain't going anywhere ",0.2732,positive
2009-04-07,3844652505900422022,MY FAST REMAINS UN BROKEN ,-0.4767,negative
2009-04-07,-4706715088079984726,It's been a year since Mark Speight died  A year goes so fast.,-0.5574,negative
2009-04-07,3928627766050720773,this is exactly why as cities burn worries me : &quot;As Cities Burn's third and most likely final outing&quot; - from their new album review ,-0.4215,negative
2009-04-07,-2406807426679986700,I don't like this 9-5 malarky - I should be out seeing my friends who I haven't seen in months  stupid work ,-0.3421,negative
2009-04-07,8902366475719684517,"Aw balls. The new shirt I got at Aerie today doesn't fit.  I wear a medium, but they only had a small in the one...",-0.1419,negative
2009-04-07,-999726213096592673,@SaulWilliams third budget of the yr in ireland today. they want to tax text messages. pray for the poets ,0.3818,positive
2009-04-07,9018587393222307342,Finished the second research paper of the week. It's Tuesday...kind of. Kill me. Test Friday. ,-0.6908,negative
2009-04-07,986230361125849742,"@jpiasentin Same, but unfortunately I have to pack now ",-0.4767,negative
2009-04-07,8097806515815432299,will probably be in Scotland next week.  http://plurk.com/p/n0ivz,0.0,neutral
2009-04-07,-5967384728743554836,"I'm having a panic attack, so I can't sleep. Distracting myself with TV and internet. Hope this goes away soon ",-0.3843,negative
2009-04-07,-6852996206953287681,"@susanstn opps,, still unable to DM you at the moment.  maybe twitter bugs after the maintenance.",0.0,neutral
2009-04-07,1861464266246243573,my project is going down the drain  Legal issues seem to have dealt a fatal blow...,-0.4588,negative
2009-04-07,-5341045548167466351,Where's my heat and grazia subscriptions? He's probably delivered them next door ,0.0,neutral
2009-04-07,-301376607011816576,is missing n ol frend &amp; is thinking bout her rite now ,-0.296,negative
2009-04-07,-5599516091071000919,@brahhh quit smoking cigs... i dont want to look old  plus... i cant breath haha,-0.4023,negative
2009-04-07,-6933312827347356453,... OMY! Jus woke up!! But was wishing I woke up sumwer in NY!!  Lol,0.803,positive
2009-04-07,8710596338533792303,school suxxx. wish i was on tourny again ,0.4019,positive
2009-04-07,-6092125333130145063,@Ainz_dj mate what time you gettin there? not gonna be able to hang around for the late bit  but comin down to support you fo sho,0.5499,positive
2009-04-07,-2045047126597553022,@mathie makes for hard work for small businesses ,-0.1027,negative
2009-04-07,-8950220711837002349,"Well, isn't that great? Now I'm really sick, all coughing and having a sore throat. ",-0.8067,negative
2009-04-07,-4978298520602304274,"got up at 7 mistakenly, it should've been 6. ",-0.296,negative
2009-04-07,8007427154333817734,Got the BrainBone daily question wrong!  - http://apps.facebook.com/brainbone/stats/339?ref=tw,-0.5255,negative
2009-04-07,6470899062876520699,@PhillyD Wishing you the best!  &lt;3,0.75,positive
2009-04-07,-1820282485054995149,"@Rockchic65 I normally go with pumpkin patch, but a bit skint at the minute ",0.0,neutral
2009-04-07,-6457703347244197337,@headtotail Thank you   I feel sad but hope we can give her a nice life til the end now.,0.8047,positive
2009-04-07,5270297097000341148,"@msJHeart lol, yeah i'm good. i just gotta unplug it and use the other one until i can hustle up $79 bucks for a new one ",0.7845,positive
2009-04-07,6119909565764016201,cant sleep once again. i need to cuddle ,0.0,neutral
2009-04-07,3364009897725802527,"@robertzalme Yes I do... Too much theory getting in, not much solutions coming out... ",0.2919,positive
2009-04-07,3430816637189351148,Going to school in twenty minutes. I have a head-ache T_T. I'm not looking forward to meeting my angry teacher ,-0.5106,negative
2009-04-07,4742241357003216789,Its wayy to early to be awake... zZz!! ,-0.4184,negative
2009-04-07,-7947763851693320360,attack of the hayfever! noooo ,-0.5255,negative
2009-04-07,-6187264765644412360,need hugs ,0.4939,positive
2009-04-07,-2939826077455582403,@neevd know of any more sites to play games on? i'll never get past the second footpath on frogger ,0.3947,positive
2009-04-07,-6904318159070889680,Playing Killzone 2... the demo ,0.2023,positive
2009-04-07,-8113577231572484677,"@iloveAC slut, you never talk to me! but yet you talk to rinn!  waa waaa waaaaaaaa lol i love you courtney (:",0.9323,positive
2009-04-07,2095911839991764006,"@mrsfr Yes, unfortunately the date clashed with an important and long standing family party, got to do it on my own ",0.5859,positive
2009-04-07,1148514386064424285,I am having my coffee.  I see frost on the car windows   I suspected there would be some this am.  I hope I am not so tired today.,0.616,positive
2009-04-07,3926792934909409333,My comp is so screwed up ,-0.6269,negative
2009-04-07,7630387283277494853,@JessicaFilan it is ,0.0,neutral
2009-04-07,544994705113967236,"@Charliecondou 4SkinMusic, more like ",0.4201,positive
2009-04-07,2575582518227670001,"@crazytwism i know..they block orkut in dubai!! in oman they have orkut access,but skype is banned!  ru from the gulf?",-0.7767,negative
2009-04-07,-5682873862789115409,hates the waiting game. she hates uncertainties too. ,-0.802,negative
2009-04-07,8997419603745049990,My throat hurts. I think I have a cold ,-0.4767,negative
2009-04-07,-8144965560630522990,now I'm kind of sad after all the bullshit I found out ,-0.8016,negative
2009-04-07,1885949584701995652,"Ow,I totally ate pavement this morn at Stephens Green Luas stop.So sore!AND THERE WAS A FREAKING TV CAMERA THERE!Of all the times to fall ",-0.627,negative
2009-04-07,6638184468632935023,Jamming postponed again! Boohoohoozx damn you flu bug! ,-0.7707,negative
2009-04-07,6096673217643273816,my baby just went home ,0.0,neutral
2009-04-07,1436379539926384547,Another morning at .net towers.. still on deadline ,0.0,neutral
2009-04-07,5511730568939683821,"wakey Wakey, I'm bored '.' My dog is annoying  He weights 20 pounds and doesn't want to come off of my knees",-0.6152,negative
2009-04-07,-8125196244102183088,; i miss family guyyy. ,-0.1531,negative
2009-04-07,-8083660551695152688,tired and borrrrrred this vacation  sooooooo hot,-0.4404,negative
2009-04-07,5652850866065231191,"Just Sitting ,Waiting  ",0.0,neutral
2009-04-07,7917981690167744327,"sitting at home, watching Jeremy Kyle and bored! ",-0.3382,negative
2009-04-07,-5431674612983107401,still in germany! ,0.0,neutral
2009-04-07,-6802882624506703518,Stuck on my own at work super stressed. I wish i was somewhere else ,0.4939,positive
2009-04-07,-3990246084103013259,"@kateblogs no, it's because i'm an author, not a subscriber ",0.0,neutral
2009-04-07,-7455295132392980723,Why am I up so EARLY!! -- I am bored and have had that trantula song stuck in my head for the past HOUR!!  / www.StalkDaily.com/georg ...,-0.6449,negative
2009-04-07,4145520035404452606,Feels like a cramp. Quite disconcerting ,0.1779,positive
2009-04-07,3230616216519670864,@skynicmac shame ,-0.4767,negative
2009-04-07,7387741525087558551,one of my site's PR dropped  http://plurk.com/p/n0jlt,0.0,neutral
2009-04-07,4642442985095200670,@McBesty monday is usually a working day? ,0.0,neutral
2009-04-07,1282018058756688361,@maxbarners  I hope it all goes well.,0.6124,positive
2009-04-07,-1455621239537418657,is supposed to work for university but the construction sight close by makes contant noise ,0.0,neutral
2009-04-07,5643576684323956989,@CruciFire DAMIT! That was my idea for today's comic!!!! Just wrote it down.    Will give credit then.,0.5815,positive
2009-04-07,-1459359886900200333,Zen sushi for lunch today...looks like it's raining outside ,0.3612,positive
2009-04-07,-8711328666152801659,"Ashley tisdale, I love you!!! But why did you dye your hair?! ",0.5815,positive
2009-04-07,-8288644579348217018,didnt announce reading lineup ,0.0,neutral
2009-04-07,1035156006258079504,"@RonJeffries I'd love to hire you again too, it was tons of fun last time. I don't do the budget tho. Or the hiring ",0.8176,positive
2009-04-07,3500450355575518281,Off to see my German girl for her last night in Brisbane ,0.0,neutral
2009-04-07,-5939682677956610694,"@micameli ???????????My friend was supposed to be having one, but it hasn't been arranged yet ",0.4696,positive
2009-04-07,785078838902687503,LAN at @JetBlackOnyx's with @miss_mell was a blasty-blast. Now it's time for home ,0.0,neutral
2009-04-07,8690592508589275229,Gnah! Inner tube exploded. Gotta get a taxi to work or be late. ,0.0,neutral
2009-04-07,3479325264361024568,"good morning - i am going for a run this morning, then its off to the dentist for some drilling ",0.4404,positive
2009-04-07,-2802703569120296584,@cubedweller Gah - not for me on freeview then  Still - if they brought over the Colbert Report I'd consider switching just to get that.,0.0,neutral
2009-04-07,1946675031088317438,"i'm in my clinic, its booring  http://twitpic.com/2y6qq",0.0,neutral
2009-04-07,-3379064151609852954,"Only 18 more days left in london, where did the time go ",0.0,neutral
2009-04-07,-8361056251764773354,@jerrrm today can not. meeting the whole day. gilaaaa ,0.0,neutral
2009-04-07,8417387692220187809,hungry  dreaming of yumyums..,0.0,neutral
2009-04-07,4036924193142249054,No gym yesteday!!!! They have a all new gym so I need a new induction  good news is it's booked for Wednesday woot!!!,0.6876,positive
2009-04-07,790411325734628649,Ughhhhh I so didn't see that coming on house. Ilu bb ,0.6597,positive
2009-04-07,-7003723609544712493,@gfalcone601 nawww take me to london please? cornwall's boring ,0.0,neutral
2009-04-07,-1250553896403571935,My website is down.. ,0.0,neutral
2009-04-07,9211019093803190575,@KingKiwi  i want to be somewhere with no rain its not very nice here today,-0.5344,negative
2009-04-07,-181908183672137236,306 letters to be sent out!! better start writing now ,0.5399,positive
2009-04-07,-106814614581138186,@llordllama oh no  I had an Obadiah too. Names that start with E are generally good.,0.1779,positive
2009-04-07,-4869313039201946142,"@valdezign hmm, this beta of Nambu has ping.fm and friendfeed disabled.  boo. ",0.0,neutral
2009-04-07,-8071065498570385790,ohhh  not very well. and i've lost my voice     ,-0.5156,negative
2009-04-07,3227474529835455479,ARIZONAAAA! - japannaly: hhhahaha now you can�t go thursday! YOU BITCH!  jk hahaha http://tumblr.com/xej1jtj9w,-0.2285,negative
2009-04-07,-3671572321676401541,"BOOO EE you suck! WHY Daniella, don't bring Sam back at all if it has to be her! Not happy  ",-0.7566,negative
2009-04-07,-4550822383122289927,@fabianv what kind of docs? and what are you using to write them? we're always behind on our docs ,0.0,neutral
2009-04-07,-2165720777830533368,Wishes she didn't have OM homework to do right now ,0.1531,positive
2009-04-07,-3117869450962837241,Ok here's the deal i live in a small town i've never seen anythin famous n anyway so i thought i might luck up on something ,0.6369,positive
2009-04-07,-8856734308406826206,@duskyazure least U got 2 lie in - I 've bn up way 2 long!! Mrs woke up at 6am this morning &amp; dragd me out of slumberlnd @ the same time ,0.0,neutral
2009-04-07,-6748594191341454430,I'm trying to plan trips...low budget though...don't think it is working ,0.0,neutral
2009-04-07,2768433256434815423,@IanHanlon Me and Scobz goal is to get a celeb to respond to one of our tweets before we go to sleep.  I may not get any sleep ,0.0,neutral
2009-04-07,-2281433151081005368,nobody ever speaks to me now ,0.0,neutral
2009-04-07,4180776279954143716,Waiting For Tom To Call ,0.0,neutral
2009-04-07,5097938034985689117,"it's mums birthday, im glad she likes her pressies. i'm looking forward to party time later this week, but sad im not going to cornwall ",-0.1027,negative
2009-04-07,4841506947728803814,@dajbelshaw sounds like my every day  except gym,0.3612,positive
2009-04-07,-835077952324006327,My car arrived!! ....maybe i'll get it on thursday....damn paperwork ,0.0,neutral
2009-04-07,-25786530171134286,Someone (@Ratsofatsorat) left a few sips of mocha in the reusable coffee mug.   Last week.  Now it's chunky ,0.0,neutral
2009-04-07,-3717357030614262485,"Omg, whats with Windows Vista today. Tried installing it on my Windows 7 laptop and its died! Reinstall ",-0.5983,negative
2009-04-07,8303427892612340207,I mean nobody goes on this anymore  x,0.0,neutral
2009-04-07,-4509180460587630754,dear twitter... i have 4 bug bites on my leg. :\ they r itchyyyy....  haha just got outta the shower. uhh night.,0.5106,positive
2009-04-07,-1135876838528254171,@thomassonora I had the same problem  #poken #error,-0.6597,negative
2009-04-07,-2109259003797935824,"@tracitoguchi Nah not really, feeling it come back on ",-0.2469,negative
2009-04-07,3741421207893301806,@MushyV Ahhhhh that Hoff programme sounded CLASSS!!!! I fuckin missed it  hopes there's a repeat innit,0.4096,positive
2009-04-07,-4054044477667726632,confused what he should do with his life ,-0.3182,negative
2009-04-07,-2356998793521647655,@grunt121 Good luck with The Big Meeting.    I hope the rumour mill is wrong.,0.6908,positive
2009-04-07,-8199668515335098515,@j_xx is the white guy manager there? the one that shouts when you walk in?  I wanna go back and feast!,0.0,neutral
2009-04-07,8856224955351568089,no missing 17 again on thursday is the worst ,-0.4959,negative
2009-04-07,2399747401922825671,"Hello world, i dont like to do physics. ",-0.2755,negative
2009-04-07,-881803205867865716,"Going to the dentist again  I mean, tooth spa right @valeriekhoo ;)",0.2263,positive
2009-04-07,8605271074778885594,My boyfriend means the world to me but he just doesn't seem to see it ....muchless understand ,0.0,neutral
2009-04-07,4062070458353266440,@Natazzz *hurt and sad* ,-0.7579,negative
2009-04-07,-8795828631299086568,"Finished marking can't celebrate yet tho, got to communicate marks &amp; feedback to all those online students, rest of the night gone there ",-0.4585,negative
2009-04-07,-1329686600123754726,"Is still sick, hate this ",-0.7906,negative
2009-04-07,-4168582522119900614,Simon Felice is no longer playing with the Felice Brothers. I'm not sure how I feel about that. ,-0.5795,negative
2009-04-07,-5754719655500942918,ears size 00 hurt  watching chaos theory!!! wonderful movie love it!,0.453,positive
2009-04-07,-8327138913405965797,going on holidays with my friend tomorrow exited but no twitter ,0.0258,neutral
2009-04-07,4817966898174755537,Looks like the Nobel peace prize is simply a popularity contest   http://tinyurl.com/cffz4h,0.9081,positive
2009-04-07,-7095055146933071258,oww the poor darling    Body of missing Tracy girl Sandra Cantu  found inside suitcase www.tinyurl.com/dfhvzg  #tracy,-0.128,negative
2009-04-07,2554371525660456160,ugh why did my mum wake me up so early!! 8:45 geesh! I NEED SLEEP! And @princessnadys...there is noth  awww ,-0.6083,negative
2009-04-07,-3679400760799498909,"but I have to work now, so no time to play ",-0.1777,negative
2009-04-07,-6226377430443257565,@haylieofficial every night ,0.0,neutral
2009-04-07,1618609319429744963,"No post or even any email, nobody loves you when your down, I'd take a long walk but don't have energy to get out of chair ",-0.1207,negative
2009-04-07,6309560671899975161,via @chrismevans: Argh.  Driving into London today.  Made a wrong turn at Kings-X - stuck in an extra 30 minutes of logjam traffic ,-0.6249,negative
2009-04-07,-8145533970483822246,@mattg00d i dont like you not having internet. You dont tweet as much. ,-0.2755,negative
2009-04-07,415286216228985553,@jodie_lane JODIE? ARE YOU AWAKE? ARE YOU HUNGRY? DO YOU NEED ANYTHING? coz i'm leaving. coz you wont talk to me ,0.0,neutral
2009-04-07,-9121518288447689368,@llaacceeyy haha i'm not a good cook at all  it looks pretty foul right now. love having voguettes on twitter yay! nice to meet you x,0.9381,positive
2009-04-07,1120481041032678851,"Needs to go to the dentist now. What a perfect start for the holidays,hm?   ",0.5719,positive
2009-04-07,3187491120696898761,has no milk for a cup of tea ,-0.296,negative
2009-04-07,-1844071580243808298,MOTHER FUCKERS. CHANGING THE ROTAS WITHOUT TELLING ME = NOT COOL. OFF TO WORK. ,-0.7985,negative
2009-04-07,-4630922136838968382,why can I not add my boyfriend!!!!! ,0.0,neutral
2009-04-07,5369182941001643101,"arghhhhhh , can`t put a profile picture here , so i`m sorry guy`s , don`t know what to do now  ",-0.1477,negative
2009-04-07,796140212354356451,@lolzitsmel  Paranormal was pretty good tonight!,0.75,positive
2009-04-07,5625871698461222225,@Glinner Don't think that's the right username for Mr Brooks ,0.0,neutral
2009-04-07,84492649337804941,Its a grey day in London come back sun all is forgiven ,0.4215,positive
2009-04-07,2063992508495927362,I HATE WINDOWS MOVIE MAKER....  SONY VEGAS COME BACK!! I cant download it anymore. My brother banned me from downloading.. ? (,-0.8409,negative
2009-04-07,917488412404197562,i cant stop laughing @ this burger king commerical.....im so easily amused  ,0.6656,positive
2009-04-07,9141401424560539872,@davidkudrev It's just a pity that Facebook Chat has exceeded even MSN's amazingly level of unreliability! ,-0.3595,negative
2009-04-07,1268623994709145100,Pity I'll have to remove it because it's irrelevant. ,-0.296,negative
2009-04-07,424416337499855814,Hubby has such a tight scedule for us during easter vaca that its stressing me out... 8 visits all over Denmark in 6 days ,-0.3612,negative
2009-04-07,6996250489216624663,"@rickrodgers just kidding man. RIM doesn't even have a sync client for Linux, and the opensync package sucks  at least it can charge lolz",0.3818,positive
2009-04-07,3155887538478941854,..... Oh and my agents had me booked out the wrong days.  X1000000,-0.4767,negative
2009-04-07,-9215257701242383898,"going out with josh, of course i broke up with will but was it the right thing to do???? i feel so bad  so confused...",-0.939,negative
2009-04-07,7637726500703899045,i wish my new glasses weren't so expensive ,0.4019,positive
2009-04-07,-4220630221073057685,Yummy pizza for dinner. Top of mouth burnt now though ,0.6369,positive
2009-04-07,-3938618228164014618,Literally spitting blood. ,0.0,neutral
2009-04-07,7852076381583998582,im just a little bit bored down here in warrnambool  only so many animal docos you can handle,-0.2075,negative
2009-04-07,6478750724836995971,Wordpress is being a bitch-ass bitch! Otherwise there'd be a new Silence remix up ,-0.6239,negative
2009-04-07,5145985356258442356,@casasteve VW forums are a nightmare for that. Enthusiasts on forums always results in politics and bitching! ,0.1511,positive
2009-04-07,-2306383482631466294,is awake at a sensible time and is doing alot of coursework bohoo ,0.0,neutral
2009-04-07,-8421991604528710750,@Schofe That sounds like a great show! Shame I'm at work ,0.5848,positive
2009-04-07,-3197330052559211208,@Wyldceltic1 so i read! i'm glad you're doing better. ,0.7345,positive
2009-04-07,1793100513189351005,@emperoremil yup. I'm at work. I'm on midshift na e. ,0.0,neutral
2009-04-07,1467377309402153433,@burjz UGH I DIDN'T MEAN TO SIGN OFF and then when I got back you were gone ,-0.5473,negative
2009-04-07,-1601226209822226692,My baby's heading for Perth ,0.0,neutral
2009-04-07,5427831105168062138,uh D: why did the dentists hurt today. holy crap i feel like my teeth are all about to fall out ,-0.1449,negative
2009-04-07,2985524733524322562,Nobody will let me make one giant cookie ,0.0,neutral
2009-04-07,7799017993810829336,going for a ride i hate my legs ,-0.5719,negative
2009-04-07,1591210987174303661,feels sick and needs foood. i cant find my camera anywhere!  last night was good. lindsay's house is pretty ruined eek.,-0.1511,negative
2009-04-07,-8734192190390648790,"@omkar_kurode : you won coz i created &quot;avenues&quot; for you! and yeah, i made the mistake of choosing TANGO over ZONE ",0.6996,positive
2009-04-07,-8056993345453214139,Sometimes YouTube has no sound on Ubuntu ,-0.296,negative
2009-04-07,8343316040181874216,cannot find her phone ,0.0,neutral
2009-04-07,7285757682231290493,"might have to go to hospital on my foot for an x-ray, have to wait for the doctor to call me back to confirm, I HATE HOSPITALS!!! ",-0.7437,negative
2009-04-07,-1391664723782627770,Ahh sorry ya';ll for not being able to twitter from the show my phone so did not work in there at all  But brit was amazeing....ahhh,-0.0387,neutral
2009-04-07,7201228315420851389,"I'm so damn tired today, actually I need to take a nap when I'm at home but there's no time ",-0.7083,negative
2009-04-07,-6747350130039005141,"Just woke up, tiresome times ",0.0,neutral
2009-04-07,-6457477526425783683,"@Heromancer come back to orlando again sooon! i couldn't make it to the show, sadly ",-0.4753,negative
